Median_Success_Rate,High School,Total_Instances,Success_Ranks,Corrected_Success_Ranks
386.0,HİSAR EĞİTİM VAKFI ÖZEL HİSAR LİSESİ (İSTANBUL - EYÜPSULTAN),1,[386.0],[386.0]
452.0,ÖZEL İNTEGRAL ANADOLU LİSESİ (MALATYA - YEŞİLYURT),1,[452.0],[452.0]
945.0,ÖZEL SAKARYA BAHÇEŞEHİR KOLEJİ ANADOLU LİSESİ (SAKARYA - ADAPAZARI),1,[945.0],[945.0]
1008.0,TED İSTANBUL KOLEJİ VAKFI ÖZEL LİSESİ (İSTANBUL - BEYKOZ),1,[1.008],[1008.0]
1242.0,ÖZEL ERYAMAN DÜŞÜN ANADOLU LİSESİ (ANKARA - ETİMESGUT),1,[1.242],[1242.0]
1348.0,BTSO HÜSEYİN SUNGUR ANADOLU LİSESİ (BURSA - OSMANGAZİ),1,[1.348],[1348.0]
1348.0,ÖZEL MARMARA EVLERİ İHLAS ANADOLU LİSESİ (İSTANBUL - BEYLİKDÜZÜ),1,[1.348],[1348.0]
1419.0,ÖZEL MADALYON KOLEJİ ANADOLU LİSESİ (ANTALYA - MANAVGAT),1,[1.419],[1419.0]
1603.0,ÖZEL ILGIN ARVEN ANADOLU LİSESİ (KONYA - ILGIN),1,[1.603],[1603.0]
1603.0,ÖZEL DEFNE EKİN FEN LİSESİ (HATAY - DEFNE),1,[1.603],[1603.0]
1603.0,MİLLÎ ŞEHİT KAYMAKAM KEMAL BEY FEN LİSESİ (YOZGAT - BOĞAZLIYAN),1,[1.603],[1603.0]
1676.0,ÖZEL BATIKENT ORTADOĞULULAR ANADOLU LİSESİ (ANKARA - YENİMAHALLE),1,[1.676],[1676.0]
1858.0,BJK KABATAŞ VAKFI ÖZEL ANADOLU LİSESİ (İSTANBUL - ÜSKÜDAR),1,[1.858],[1858.0]
2053.0,ÖZEL ANTALYA YEDİİKLİM ANADOLU LİSESİ (ANTALYA - MURATPAŞA),1,[2.053],[2053.0]
2388.0,ÖZEL EVİM MARTI ANADOLU LİSESİ (ZONGULDAK - EREĞLİ),1,[2.388],[2388.0]
2392.0,ÖZEL ORDU DOĞA FEN LİSESİ (ORDU - GÜLYALI),1,[2.392],[2392.0]
2474.0,ÖZEL FİNAL AKADEMİ ANADOLU LİSESİ (KÜTAHYA - MERKEZ),1,[2.474],[2474.0]
2474.0,ÖZEL ANKARA AÇI TEMEL LİSESİ (ANKARA - ÇANKAYA),1,[2.474],[2474.0]
2490.75,ÖZEL BAHÇEŞEHİR FEN VE TEKNOLOJİ LİSESİ (İSTANBUL - EYÜPSULTAN),4,"[1.234, 1.858, 3.294, 3.577]","[1234.0, 1858.0, 3294.0, 3577.0]"
2508.0,KARAPINAR İBRAHİM GÜNDÜZ ANADOLU LİSESİ (KONYA - KARAPINAR),1,[2.508],[2508.0]
2792.0,ÖZEL SİLİFKE GÖKSU ANADOLU LİSESİ (MERSİN - SİLİFKE),1,[2.792],[2792.0]
2963.0,ÖZEL AKA KOLEJİ (İSTANBUL - BAHÇELİEVLER),1,[2.963],[2963.0]
3035.0,ÖZEL SANCAKTEPE BATI FEN BİLİMLERİ ANADOLU LİSESİ (İSTANBUL - SANCAKTEPE),1,[3.035],[3035.0]
3294.0,RECEP TAYYİP ERDOĞAN KIZ ANADOLU İMAM HATİP LİSESİ (İSTANBUL - SULTANGAZİ),1,[3.294],[3294.0]
3294.0,FMV ÖZEL ISPARTAKULE IŞIK LİSESİ (İSTANBUL - AVCILAR),1,[3.294],[3294.0]
3346.6666666666665,ÖZEL ENKA LİSESİ (İSTANBUL - SARIYER),3,"[1.008, 1.311, 7.721]","[1008.0, 1311.0, 7721.0]"
3356.0,ÖZEL FARK ANADOLU LİSESİ (ANTALYA - MANAVGAT),1,[3.356],[3356.0]
3501.5,ÜMİTKÖY ANADOLU İMAM HATİP LİSESİ (ANKARA - ÇANKAYA),2,"[1.804, 5.199]","[1804.0, 5199.0]"
3577.0,ÖZEL SUSURLUK FİNAL AKADEMİ ANADOLU LİSESİ (BALIKESİR - SUSURLUK),1,[3.577],[3577.0]
3577.0,KULA BEKİR SACİDE KELEŞOĞLU ANADOLU LİSESİ (MANİSA - KULA),1,[3.577],[3577.0]
3659.0,AFYONKARAHİSAR HATTAT AHMET KARAHİSARİ ANADOLU İMAM HATİP LİSESİ (AFYONKARAHİSAR - MERKEZ),1,[3.659],[3659.0]
3659.0,ÖZEL ÇAKIRLAR ŞENER ÇAKMAK FEN LİSESİ (ANKARA - YENİMAHALLE),1,[3.659],[3659.0]
3689.0,ÖZEL GÜNEŞLİ SINAV FEN LİSESİ (İSTANBUL - BAĞCILAR),1,[3.689],[3689.0]
3689.0,ÖZEL ÇAĞ FEN VE TEKNOLOJİ LİSESİ (MERSİN - TARSUS),1,[3.689],[3689.0]
3771.0,ÖZEL KUMLUCA SINAV ANADOLU LİSESİ (ANTALYA - KUMLUCA),1,[3.771],[3771.0]
3771.0,İSTEK ÖZEL KEMAL ATATÜRK ANADOLU LİSESİ (İSTANBUL - SARIYER),1,[3.771],[3771.0]
4122.0,ÖZEL ALTINDAĞ FİNAL AKADEMİ ANADOLU LİSESİ (ANKARA - ALTINDAĞ),1,[4.122],[4122.0]
4270.0,KOCAHASANLI ANADOLU LİSESİ (MERSİN - ERDEMLİ),1,[4.27],[4270.0]
4344.0,ÖZEL ÇEKMECE DOĞA FEN VE TEKNOLOJİ LİSESİ (İSTANBUL - BÜYÜKÇEKMECE),1,[4.344],[4344.0]
4377.0,ÖZEL BİLİM KOLEJİ ANADOLU LİSESİ (ANKARA - ÇANKAYA),1,[4.377],[4377.0]
4620.5,ÖZEL İDEA FEN LİSESİ (BURSA - OSMANGAZİ),2,"[3.294, 5.947]","[3294.0, 5947.0]"
5145.0,EDİRNE AKMERCAN ANADOLU İMAM HATİP LİSESİ (EDİRNE - MERKEZ),1,[5.145],[5145.0]
5145.0,KUMRU ANADOLU İMAM HATİP LİSESİ (ORDU - KUMRU),1,[5.145],[5145.0]
5145.0,ÖZEL AÇI ANADOLU LİSESİ (DENİZLİ - PAMUKKALE),1,[5.145],[5145.0]
5145.0,ÖZEL KASTAMONU BAHÇEŞEHİR KOLEJİ ANADOLU LİSESİ (KASTAMONU - MERKEZ),1,[5.145],[5145.0]
5145.0,ERGANİ SULTAN ABDÜLHAMİD HAN ANADOLU LİSESİ (DİYARBAKIR - ERGANİ),1,[5.145],[5145.0]
5145.0,GÖZTEPE ANADOLU LİSESİ (MALATYA - BATTALGAZİ),1,[5.145],[5145.0]
5199.0,NİĞDE ÇAĞDAŞ EĞİTİM VAKFI ÖZEL FEN LİSESİ (NİĞDE - MERKEZ),1,[5.199],[5199.0]
5199.0,YENİKENT İLKSAN ANADOLU LİSESİ (ANKARA - SİNCAN),1,[5.199],[5199.0]
5199.0,ÖZEL MERSİN BİLİMKENT KOLEJİ FEN VE TEKNOLOJİ KOLEJİ (MERSİN - MEZİTLİ),1,[5.199],[5199.0]
5199.0,ÖZEL GİRESUN DOĞA FEN LİSESİ (GİRESUN - MERKEZ),1,[5.199],[5199.0]
5290.0,ÖZEL KAHTA FİNAL AKADEMİ ANADOLU LİSESİ (ADIYAMAN - KAHTA),1,[5.29],[5290.0]
5290.0,ÖZEL ROTA ANADOLU LİSESİ (İZMİR - GAZİEMİR),1,[5.29],[5290.0]
5290.0,ÖZEL KENT ANADOLU LİSESİ (İZMİR - GAZİEMİR),1,[5.29],[5290.0]
5290.0,ÖZEL MAVİŞEHİR OKYANUS ANADOLU LİSESİ (İZMİR - KARŞIYAKA),1,[5.29],[5290.0]
5361.0,ÖZEL BİNGÖL BİLİMYOLU KOLEJİ ANADOLU LİSESİ (BİNGÖL - MERKEZ),1,[5.361],[5361.0]
5607.0,ÖZEL BAHÇEŞEHİR KOLEJİ İSKENDERUN ANADOLU LİSESİ (HATAY - BELEN),3,"[1.242, 3.689, 11.89]","[1242.0, 3689.0, 11890.0]"
5725.0,MUĞLA KIZ ANADOLU İMAM HATİP LİSESİ (MUĞLA - MENTEŞE),1,[5.725],[5725.0]
5725.0,ÖZEL YENİŞEHİR DETAY ANADOLU LİSESİ (MERSİN - YENİŞEHİR),1,[5.725],[5725.0]
5725.0,ORHANGAZİ ANADOLU İMAM HATİP LİSESİ (İSTANBUL - BAĞCILAR),1,[5.725],[5725.0]
5725.0,ÖZEL EGEBİL ASLAN YENİ NESİL FEN LİSESİ (GAZİANTEP - ŞEHİTKAMİL),1,[5.725],[5725.0]
5725.0,ÖZEL ANKARA ZAFER ANADOLU LİSESİ (ANKARA - ETİMESGUT),1,[5.725],[5725.0]
5732.333333333333,ÖZEL ERA EĞİTİMDE RASYONEL AÇILIM ANADOLU LİSESİ (BURSA - NİLÜFER),3,"[5.145, 5.29, 6.762]","[5145.0, 5290.0, 6762.0]"
5787.0,ÖZEL KIRIKHAN SINAV KOLEJİ FEN LİSESİ (HATAY - KIRIKHAN),1,[5.787],[5787.0]
5787.0,ÖZEL MANAVGAT KOLEJİ ANADOLU LİSESİ (ANTALYA - MANAVGAT),1,[5.787],[5787.0]
5947.0,ÖZEL ÜMRANİYE AŞAMA ANADOLU LİSESİ (İSTANBUL - ÜMRANİYE),1,[5.947],[5947.0]
5964.5,ÖZEL VAN GİRNE KOLEJİ FEN LİSESİ (VAN - EDREMİT),2,"[5.29, 6.639]","[5290.0, 6639.0]"
6066.0,ÖZEL BİLGEKENT ANADOLU LİSESİ (OSMANİYE - KADİRLİ),1,[6.066],[6066.0]
6128.0,ÖZEL YEŞEREN FEN LİSESİ (İZMİR - BAYRAKLI),1,[6.128],[6128.0]
6228.0,MİMAR SİNAN ANADOLU LİSESİ (TEKİRDAĞ - ÇORLU),1,[6.228],[6228.0]
6310.0,ÖZEL ÇANKAYA DOĞA ANADOLU LİSESİ (ANKARA - ÇANKAYA),1,[6.31],[6310.0]
6310.0,ÖZEL MURATPAŞA ON ADIM EĞİTİM BİLİMLERİ ANADOLU LİSESİ (ANTALYA - MURATPAŞA),1,[6.31],[6310.0]
6310.0,ÖZEL DİKMEN HAZIRLIK FEN LİSESİ (ANKARA - ÇANKAYA),1,[6.31],[6310.0]
6310.0,ÖZEL EVRE ANADOLU LİSESİ (MERSİN - YENİŞEHİR),1,[6.31],[6310.0]
6538.5,ÖZEL POLATLI AYYILDIZ ANADOLU LİSESİ (ANKARA - POLATLI),4,"[3.577, 5.29, 7.571, 9.716]","[3577.0, 5290.0, 7571.0, 9716.0]"
6599.0,ÖZEL ASFA FEN LİSESİ (İSTANBUL - ÜSKÜDAR),9,"[1.348, 2.053, 4.686, 5.145, 6.639, 8.071, 8.262, 10.901, 12.286]","[1348.0, 2053.0, 4686.0, 5145.0, 6639.0, 8071.0, 8262.0, 10901.0, 12286.0]"
6639.0,MERAM ÖZEL SINAV ANADOLU LİSESİ (KONYA - MERAM),1,[6.639],[6639.0]
6639.0,ÖZEL EĞİTİMDE RASYONEL AÇILIM (ERA ) KOLEJİ BEYLİKDÜZÜ MARMARA EVLERİ ANADOLU LİSESİ (İSTANBUL - BEYLİKDÜZÜ),1,[6.639],[6639.0]
6639.0,ÖZEL BİLFEN ANADOLU LİSESİ (İSTANBUL - ÜSKÜDAR),1,[6.639],[6639.0]
6639.0,ÖZEL ÇAMKENT ANADOLU LİSESİ (BOLU - MERKEZ),1,[6.639],[6639.0]
6696.75,ÖZEL IĞDIR BAHÇEŞEHİR FEN LİSESİ (IĞDIR - MERKEZ),4,"[1.935, 2.519, 3.113, 19.22]","[1935.0, 2519.0, 3113.0, 19220.0]"
6924.0,ÖZEL TRABZON SINAV KOLEJİ ANADOLU LİSESİ (TRABZON - ORTAHİSAR),2,"[4.686, 9.162]","[4686.0, 9162.0]"
7034.5,ÖZEL AVCILAR NAZMİ ARIKAN FEN BİLİMLERİ ANADOLU LİSESİ (İSTANBUL - AVCILAR),2,"[6.639, 7.43]","[6639.0, 7430.0]"
7247.0,ÖZEL BAŞİSKELE UĞUR FEN LİSESİ (KOCAELİ - BAŞİSKELE),2,"[5.199, 9.295]","[5199.0, 9295.0]"
7310.0,ÖZEL GÖRKEM FEN LİSESİ (ANKARA - ETİMESGUT),1,[7.31],[7310.0]
7320.0,ŞİRAN FEN LİSESİ (GÜMÜŞHANE - ŞİRAN),1,[7.32],[7320.0]
7320.0,ERZURUM ANADOLU İMAM HATİP LİSESİ (ERZURUM - YAKUTİYE),1,[7.32],[7320.0]
7320.0,ÖDEMİŞ ANADOLU LİSESİ (İZMİR - ÖDEMİŞ),1,[7.32],[7320.0]
7320.0,ÖZEL BARTIN DENİZ KOLEJİ ANADOLU LİSESİ (BARTIN - MERKEZ),1,[7.32],[7320.0]
7320.0,ÖZEL YAVUZOĞLU ANADOLU LİSESİ (AFYONKARAHİSAR - MERKEZ),1,[7.32],[7320.0]
7571.0,ŞEHİT FAZIL YILDIRIM ANADOLU LİSESİ (ESKİŞEHİR - ODUNPAZARI),1,[7.571],[7571.0]
7571.0,ÖZEL MUŞ BİREY ANADOLU LİSESİ (MUŞ - MERKEZ),1,[7.571],[7571.0]
7571.0,ÖZEL OYA AKIN YILDIZLAR ANADOLU LİSESİ (ANKARA - ÇANKAYA),1,[7.571],[7571.0]
7583.0,ÖZEL BAŞARFEN KOLEJİ ANADOLU LİSESİ (ANKARA - KEÇİÖREN),1,[7.583],[7583.0]
7619.0,ÖZEL BAHÇEŞEHİR LİSESİ (İSTANBUL - BAŞAKŞEHİR),7,"[2.053, 3.689, 3.771, 6.639, 8.071, 12.558, 16.552]","[2053.0, 3689.0, 3771.0, 6639.0, 8071.0, 12558.0, 16552.0]"
7721.0,ÖZEL BATIKENT YÖNDER ANADOLU LİSESİ (ANKARA - YENİMAHALLE),1,[7.721],[7721.0]
7768.785714285715,ÖZEL ENKA FEN VE TEKNOLOJİ LİSESİ (KOCAELİ - DİLOVASI),14,"[24.0, 386.0, 1.008, 1.288, 1.858, 2.887, 2.963, 3.294, 3.658, 6.639, 7.296, 12.201, 12.236, 29.049]","[24000.0, 386.0, 1008.0, 1288.0, 1858.0, 2887.0, 2963.0, 3294.0, 3658.0, 6639.0, 7296.0, 12201.0, 12236.0, 29049.0]"
7987.5,PROF. DR. MÜMTAZ TURHAN SOSYAL BİLİMLER LİSESİ (İSTANBUL - BAHÇELİEVLER),2,"[3.689, 12.286]","[3689.0, 12286.0]"
8015.5,ÖZEL BAŞARILI ANADOLU LİSESİ (İSTANBUL - BAHÇELİEVLER),2,"[3.689, 12.342]","[3689.0, 12342.0]"
8080.25,İZMİR BÜYÜKÇİĞLİ ÖZEL TÜRK KOLEJİ FEN LİSESİ (İZMİR - ÇİĞLİ),4,"[1.288, 2.053, 6.399, 22.581]","[1288.0, 2053.0, 6399.0, 22581.0]"
8158.333333333333,ÖZEL BATI ANADOLU LİSESİ (ANTALYA - MANAVGAT),6,"[1.008, 1.242, 1.603, 3.577, 13.564, 27.956]","[1008.0, 1242.0, 1603.0, 3577.0, 13564.0, 27956.0]"
8171.444444444444,ÖZEL ANKARA MAYA FEN VE TEKNOLOJİ LİSESİ (ANKARA - GÖLBAŞI),9,"[1.603, 3.063, 3.659, 4.377, 5.199, 6.066, 9.61, 16.052, 23.914]","[1603.0, 3063.0, 3659.0, 4377.0, 5199.0, 6066.0, 9610.0, 16052.0, 23914.0]"
8201.0,FUAT SEZGİN ANADOLU LİSESİ (ERZURUM - PALANDÖKEN),1,[8.201],[8201.0]
8201.0,ŞEHİT ÜSTEĞMEN SELÇUK ESEDOĞLU ANADOLU LİSESİ (SAKARYA - SERDİVAN),1,[8.201],[8201.0]
8262.0,FARABİ ANADOLU LİSESİ (DÜZCE - MERKEZ),1,[8.262],[8262.0]
8358.0,ÖZEL OKYANUS FEN VE PROJE LİSESİ (İSTANBUL - AVCILAR),3,"[3.689, 10.484, 10.901]","[3689.0, 10484.0, 10901.0]"
8528.5,ÖZEL LARA OKYANUS FEN VE TEKNOLOJİ LİSESİ (ANTALYA - MURATPAŞA),2,"[7.43, 9.627]","[7430.0, 9627.0]"
8580.0,BUCAK ANADOLU LİSESİ (BURDUR - BUCAK),1,[8.58],[8580.0]
8580.0,ZELİHA TUNCER ANADOLU İMAM HATİP LİSESİ (ANTALYA - GAZİPAŞA),1,[8.58],[8580.0]
8580.0,ÖZEL SAMANDAĞ YÜKSELİŞ KOLEJİ ANADOLU LİSESİ (HATAY - SAMANDAĞ),1,[8.58],[8580.0]
8580.0,HACI DUDU- MEHMET GEBİZLİ KIZ ANADOLU İMAM HATİP LİSESİ (ANTALYA - MURATPAŞA),1,[8.58],[8580.0]
8699.5,ÖZEL YAVUZ FEN LİSESİ (GİRESUN - KEŞAP),4,"[2.053, 5.29, 9.627, 17.828]","[2053.0, 5290.0, 9627.0, 17828.0]"
8702.0,ÖZEL LÜLEBURGAZ İSTEK FEN LİSESİ (KIRKLARELİ - LÜLEBURGAZ),2,"[3.658, 13.746]","[3658.0, 13746.0]"
8917.0,ÖZEL SİMYA ANADOLU LİSESİ (HATAY - BELEN),1,[8.917],[8917.0]
8974.666666666666,ÖZEL KIRKLARELİ BAHÇEŞEHİR KOLEJİ ANADOLU LİSESİ (KIRKLARELİ - MERKEZ),3,"[2.963, 5.361, 18.6]","[2963.0, 5361.0, 18600.0]"
9025.0,BJK KABATAŞ VAKFI ÖZEL FEN VE TEKNOLOJİ LİSESİ (İSTANBUL - ÜSKÜDAR),1,[9.025],[9025.0]
9025.0,ÖZEL GAZİANTEP UĞUR FEN LİSESİ (GAZİANTEP - ŞAHİNBEY),1,[9.025],[9025.0]
9135.0,ÖZEL EGE BİLİM ANADOLU LİSESİ (İSTANBUL - KARTAL),2,"[5.145, 13.125]","[5145.0, 13125.0]"
9162.0,ÖZEL CİZRE FİNAL ANADOLU LİSESİ (ŞIRNAK - CİZRE),1,[9.162],[9162.0]
9177.0,GİRNE 19 MAYIS TÜRK MAARİF KOLEJİ,1,[9.177],[9177.0]
9205.0,ÖZEL KOCAELİ DOĞA FEN VE TEKNOLOJİ LİSESİ (KOCAELİ - İZMİT),2,"[1.858, 16.552]","[1858.0, 16552.0]"
9236.5,ÖZEL BEYLİKDÜZÜ BİLNET ANADOLU LİSESİ (İSTANBUL - BEYLİKDÜZÜ),2,"[7.572, 10.901]","[7572.0, 10901.0]"
9295.0,SARIGAZİ ANADOLU LİSESİ (İSTANBUL - SANCAKTEPE),1,[9.295],[9295.0]
9343.25,ÖZEL BEYSUKENT ANADOLU LİSESİ (ANKARA - ÇANKAYA),4,"[286.0, 2.408, 15.359, 19.32]","[286.0, 2408.0, 15359.0, 19320.0]"
9462.5,ÖZEL IRMAK ANADOLU LİSESİ (İSTANBUL - KADIKÖY),2,"[6.639, 12.286]","[6639.0, 12286.0]"
9505.0,ÖZEL ŞENER ÇAKMAK FEN LİSESİ (ANKARA - YENİMAHALLE),2,"[7.31, 11.7]","[7310.0, 11700.0]"
9589.0,GAZİ MUSTAFA KEMAL ANADOLU LİSESİ (ESKİŞEHİR - TEPEBAŞI),1,[9.589],[9589.0]
9610.0,FATİH ANADOLU LİSESİ (ESKİŞEHİR - ODUNPAZARI),1,[9.61],[9610.0]
9610.0,ÖZEL YAKACIK FİNAL ANADOLU LİSESİ (İSTANBUL - KARTAL),1,[9.61],[9610.0]
9627.0,MUZAFFER ÇİL ANADOLU LİSESİ (ESKİŞEHİR - TEPEBAŞI),1,[9.627],[9627.0]
9627.0,ÖZEL KURTKÖY UĞUR ANADOLU LİSESİ (İSTANBUL - PENDİK),1,[9.627],[9627.0]
9627.0,ÖZEL ŞEHİTKAMİL UYGAR ANADOLU LİSESİ (GAZİANTEP - ŞEHİTKAMİL),1,[9.627],[9627.0]
9627.0,ÖZEL ŞEFİK CÜCE ANADOLU LİSESİ (ANTALYA - MURATPAŞA),1,[9.627],[9627.0]
9643.333333333334,ÖZEL ŞEHİR KOLEJİ FEN LİSESİ (ESKİŞEHİR - ODUNPAZARI),3,"[1.763, 6.205, 20.962]","[1763.0, 6205.0, 20962.0]"
9693.5,ÖZEL METOD ANADOLU LİSESİ (ANKARA - YENİMAHALLE),2,"[1.242, 18.145]","[1242.0, 18145.0]"
9716.0,ŞEHİT EROL OLÇOK ANADOLU LİSESİ (SAKARYA - SERDİVAN),1,[9.716],[9716.0]
9716.0,ÖZEL OSMANİYE ENDER KOLEJİ (OSMANİYE - MERKEZ),1,[9.716],[9716.0]
9716.0,ÖZEL CİHAN EĞİTİM OKULLARI FEN LİSESİ (GAZİANTEP - ŞEHİTKAMİL),1,[9.716],[9716.0]
9716.0,TED KUZEY KIBRIS KOLEJİ,1,[9.716],[9716.0]
9716.0,KOCATEPE MİMAR KEMAL ANADOLU LİSESİ (ANKARA - ÇANKAYA),1,[9.716],[9716.0]
9778.0,ÖZEL GİRNE KOLEJİ BATMAN ANADOLU LİSESİ (BATMAN - MERKEZ),2,"[7.32, 12.236]","[7320.0, 12236.0]"
9787.5,ÖZEL İNEGÖL KÜLTÜR FEN LİSESİ (BURSA - İNEGÖL),2,"[6.399, 13.176]","[6399.0, 13176.0]"
9790.333333333334,ÖZEL SÖKE DOĞA ANADOLU LİSESİ (AYDIN - SÖKE),3,"[5.29, 7.32, 16.761]","[5290.0, 7320.0, 16761.0]"
9832.5,ÖZEL FİNAL AKADEMİ ANADOLU LİSESİ (ISPARTA - MERKEZ),2,"[3.294, 16.371]","[3294.0, 16370.999999999998]"
9886.0,BİGA ATATÜRK ANADOLU LİSESİ (ÇANAKKALE - BİGA),2,"[7.43, 12.342]","[7430.0, 12342.0]"
9924.333333333334,ÖZEL ACIBADEM DOĞA FEN VE TEKNOLOJİ LİSESİ (İSTANBUL - ÜSKÜDAR),3,"[1.008, 10.165, 18.6]","[1008.0, 10165.0, 18600.0]"
9990.0,ÖZEL TURGUTREİS EGE UĞUR ANADOLU LİSESİ (MUĞLA - BODRUM),2,"[4.886, 15.094]","[4886.0, 15094.0]"
10031.5,ÖZEL TÜRMAK ANADOLU LİSESİ (KONYA - SELÇUKLU),2,"[7.721, 12.342]","[7721.0, 12342.0]"
10165.0,80. YIL CUMHURİYET ANADOLU LİSESİ (OSMANİYE - MERKEZ),1,[10.165],[10165.0]
10165.0,KASTAMONU KIZ ANADOLU İMAM HATİP LİSESİ (KASTAMONU - MERKEZ),1,[10.165],[10165.0]
10165.0,ÖZEL ANTALYA RENK ANADOLU LİSESİ (ANTALYA - MURATPAŞA),1,[10.165],[10165.0]
10165.0,ÖZEL FARKLI KALİTE MODERN FEN LİSESİ (BURSA - NİLÜFER),1,[10.165],[10165.0]
10165.0,AYVALIK ANADOLU LİSESİ (BALIKESİR - AYVALIK),1,[10.165],[10165.0]
10321.0,FETHİYE ANADOLU İMAM HATİP LİSESİ (MUĞLA - FETHİYE),1,[10.321],[10321.0]
10321.0,ÖZEL KOLEJ KARATARAKLI ANADOLU LİSESİ (İZMİR - KONAK),1,[10.321],[10321.0]
10321.0,ÖZEL CEYLANPINAR AÇI ANADOLU LİSESİ (ŞANLIURFA - CEYLANPINAR),1,[10.321],[10321.0]
10450.0,ÖZEL GAZİANTEP İŞLEM ANADOLU LİSESİ (GAZİANTEP - ŞEHİTKAMİL),3,"[1.391, 3.577, 26.382]","[1391.0, 3577.0, 26382.0]"
10521.0,UFUK ARSLAN ANADOLU LİSESİ (ANKARA - ETİMESGUT),2,"[3.659, 17.383]","[3659.0, 17383.0]"
10534.333333333334,ÖZEL ANTALYA BİLİM KOLEJİ ANADOLU LİSESİ (ANTALYA - MURATPAŞA),3,"[5.199, 8.58, 17.824]","[5199.0, 8580.0, 17824.0]"
10536.5,HALICI AHMET URKAY ANADOLU LİSESİ (MUĞLA - MARMARİS),2,"[6.066, 15.007]","[6066.0, 15007.0]"
10592.333333333334,ŞEHİT EYYÜP OĞUZ ANADOLU İMAM HATİP LİSESİ (ELAZIĞ - MERKEZ),3,"[3.294, 5.199, 23.284]","[3294.0, 5199.0, 23284.0]"
10597.732142857143,İZMİR FEN LİSESİ (İZMİR - BORNOVA),56,"[122.0, 286.0, 452.0, 1.008, 1.234, 1.242, 1.288, 1.603, 1.676, 1.763, 1.858, 2.053, 2.826, 2.887, 3.063, 3.356, 3.658, 3.771, 4.344, 4.377, 4.91, 5.145, 5.29, 5.361, 6.205, 6.639, 6.762, 7.43, 8.932, 9.025, 9.627, 10.321, 11.733, 12.201, 12.683, 13.324, 14.988, 15.094, 15.66, 17.018, 17.273, 17.31, 17.383, 17.828, 17.949, 18.246, 18.6, 19.963, 20.419, 22.581, 22.842, 23.272, 23.457, 25.654, 33.408, 36.073]","[122.0, 286.0, 452.0, 1008.0, 1234.0, 1242.0, 1288.0, 1603.0, 1676.0, 1763.0, 1858.0, 2053.0, 2826.0, 2887.0, 3063.0, 3356.0, 3658.0, 3771.0, 4344.0, 4377.0, 4910.0, 5145.0, 5290.0, 5361.0, 6205.0, 6639.0, 6762.0, 7430.0, 8932.0, 9025.0, 9627.0, 10321.0, 11733.0, 12201.0, 12683.0, 13324.0, 14988.0, 15094.0, 15660.0, 17018.0, 17273.0, 17310.0, 17383.0, 17828.0, 17949.0, 18246.0, 18600.0, 19963.0, 20419.0, 22581.0, 22842.0, 23272.0, 23457.0, 25654.0, 33408.0, 36073.0]"
10601.0,ÖZEL VİZYON ANADOLU LİSESİ (İSTANBUL - BEYLİKDÜZÜ),3,"[1.935, 2.053, 27.815]","[1935.0, 2053.0, 27815.0]"
10612.0,BÜYÜK SELÇUKLU ANADOLU LİSESİ (ADANA - SEYHAN),1,[10.612],[10612.0]
10612.0,BAHÇELİEVLER ANADOLU LİSESİ (ANKARA - ÇANKAYA),1,[10.612],[10612.0]
10612.0,ÖZEL TARSUS GELECEK FEN LİSESİ (MERSİN - TARSUS),1,[10.612],[10612.0]
10612.0,ÖZEL ADANA AÇI KOLEJİ ANADOLU LİSESİ (ADANA - ÇUKUROVA),1,[10.612],[10612.0]
10612.0,ÖZEL ŞEHİR KOLEJİ ANADOLU LİSESİ (ESKİŞEHİR - ODUNPAZARI),1,[10.612],[10612.0]
10612.0,ÖZEL MALATYA FAHRİ KAYAHAN FİNAL AKADEMİ ANADOLU LİSESİ (MALATYA - YEŞİLYURT),1,[10.612],[10612.0]
10634.0,ÖZEL BURSA BİLFEN FEN LİSESİ (BURSA - MUDANYA),2,"[7.721, 13.547]","[7721.0, 13547.0]"
10692.849056603774,AYDIN FEN LİSESİ (AYDIN - EFELER),53,"[203.0, 254.0, 286.0, 945.0, 1.008, 1.242, 1.348, 1.603, 1.858, 1.935, 2.086, 2.388, 2.408, 2.826, 3.035, 3.658, 3.771, 4.27, 4.377, 4.91, 5.145, 5.199, 5.29, 5.947, 6.399, 7.32, 7.43, 7.721, 8.262, 8.58, 10.321, 12.286, 12.683, 13.255, 13.485, 14.988, 15.038, 15.819, 17.273, 17.383, 17.828, 17.949, 18.333, 18.6, 19.139, 20.037, 20.419, 22.581, 23.457, 29.065, 29.182, 37.839, 38.057]","[203.0, 254.0, 286.0, 945.0, 1008.0, 1242.0, 1348.0, 1603.0, 1858.0, 1935.0, 2086.0, 2388.0, 2408.0, 2826.0, 3035.0, 3658.0, 3771.0, 4270.0, 4377.0, 4910.0, 5145.0, 5199.0, 5290.0, 5947.0, 6399.0, 7320.0, 7430.0, 7721.0, 8262.0, 8580.0, 10321.0, 12286.0, 12683.0, 13255.0, 13485.0, 14988.0, 15038.0, 15819.0, 17273.0, 17383.0, 17828.0, 17949.0, 18333.0, 18600.0, 19139.0, 20037.0, 20419.0, 22581.0, 23457.0, 29065.0, 29182.0, 37839.0, 38057.0]"
10740.0,ÖZEL YENİ ROTA ANADOLU LİSESİ (ESKİŞEHİR - ODUNPAZARI),2,"[8.58, 12.9]","[8580.0, 12900.0]"
10740.7,ÖZEL ADANA FİNAL FEN LİSESİ (ADANA - ÇUKUROVA),20,"[122.0, 363.0, 1.858, 2.826, 2.887, 3.294, 5.145, 5.787, 7.42, 8.58, 10.321, 10.612, 13.45, 15.038, 16.371, 16.761, 17.949, 18.12, 26.044, 31.866]","[122.0, 363.0, 1858.0, 2826.0, 2887.0, 3294.0, 5145.0, 5787.0, 7420.0, 8580.0, 10321.0, 10612.0, 13450.0, 15038.0, 16370.999999999998, 16761.0, 17949.0, 18120.0, 26044.0, 31866.0]"
10759.5,ÖZEL İSTEK ANTALYA KONYAALTI ANADOLU LİSESİ (ANTALYA - KONYAALTI),2,"[3.577, 17.942]","[3577.0, 17942.0]"
10795.0,ACIPAYAM CUMHURİYET FEN LİSESİ (DENİZLİ - ACIPAYAM),1,[10.795],[10795.0]
10795.0,ÖZEL ERAL FEN LİSESİ (ADANA - ÇUKUROVA),1,[10.795],[10795.0]
10795.0,ÇİMENTAŞ ANADOLU LİSESİ (İZMİR - BORNOVA),1,[10.795],[10795.0]
10795.0,ÖZEL KEMALPAŞA ORGANİZE SANAYİ BÖLGESİ ZÜLFÜ-MEVLÜT ÇELİK MESLEKİ VE TEKNİK ANADOLU LİSESİ (İZMİR - KEMALPAŞA),1,[10.795],[10795.0]
10795.0,ÖZEL NAZİLLİ DÖRT RENK SÜMER ANADOLU LİSESİ (AYDIN - NAZİLLİ),1,[10.795],[10795.0]
10795.0,AHMET SIRIMSI ANADOLU LİSESİ (ORDU - FATSA),1,[10.795],[10795.0]
10795.0,SERİNYOL ANADOLU LİSESİ (HATAY - ANTAKYA),1,[10.795],[10795.0]
10809.0,ŞEHİT FATİH SATIR ANADOLU İMAM HATİP LİSESİ (İSTANBUL - SARIYER),2,"[8.071, 13.547]","[8071.0, 13547.0]"
10832.157894736842,ÖZEL BORNOVA FEN LİSESİ (İZMİR - BORNOVA),19,"[452.0, 1.242, 1.288, 2.408, 2.887, 4.377, 5.29, 5.361, 7.31, 7.32, 8.071, 10.321, 12.342, 15.094, 16.19, 23.36, 23.389, 23.457, 35.652]","[452.0, 1242.0, 1288.0, 2408.0, 2887.0, 4377.0, 5290.0, 5361.0, 7310.0, 7320.0, 8071.0, 10321.0, 12342.0, 15094.0, 16190.000000000002, 23360.0, 23389.0, 23457.0, 35652.0]"
10846.0,ÖZEL KIRDAR BİLGİÖREN KOLEJİ FEN LİSESİ (KÜTAHYA - MERKEZ),2,"[10.165, 11.527]","[10165.0, 11527.0]"
10901.0,MEHMET AKİF İNAN HAFIZ ANADOLU İMAM HATİP LİSESİ (DÜZCE - MERKEZ),1,[10.901],[10901.0]
10901.0,GÜNGÖREN ERDEM BAYAZIT ANADOLU LİSESİ (İSTANBUL - GÜNGÖREN),1,[10.901],[10901.0]
10915.25,ÖZEL ANKARA UĞUR ANADOLU LİSESİ (ANKARA - ÇANKAYA),4,"[4.686, 5.199, 15.007, 18.769]","[4686.0, 5199.0, 15007.0, 18769.0]"
10959.833333333334,ÖZEL BAFRA AÇI FEN LİSESİ (SAMSUN - BAFRA),6,"[945.0, 3.577, 5.199, 9.175, 18.907, 27.956]","[945.0, 3577.0, 5199.0, 9175.0, 18907.0, 27956.0]"
10981.666666666666,ÖZEL NAZİF TOKGÖZ BAŞARI ANADOLU LİSESİ (KOCAELİ - GÖLCÜK),3,"[8.262, 9.589, 15.094]","[8262.0, 9589.0, 15094.0]"
11019.739726027397,ADANA FEN LİSESİ (ADANA - SEYHAN),73,"[122.0, 254.0, 286.0, 363.0, 758.0, 945.0, 1.008, 1.242, 1.348, 1.603, 1.763, 1.858, 1.935, 2.053, 3.035, 3.063, 3.113, 3.294, 3.577, 3.658, 3.659, 3.771, 4.27, 4.344, 4.377, 4.686, 4.886, 5.199, 5.29, 5.725, 6.205, 6.228, 6.31, 6.639, 7.296, 7.32, 7.571, 8.566, 8.58, 8.932, 9.716, 10.612, 10.901, 12.201, 12.342, 13.25, 14.089, 14.136, 14.61, 15.033, 15.038, 15.66, 15.819, 16.846, 17.273, 17.31, 17.824, 18.769, 20.156, 22.085, 22.181, 22.575, 22.581, 23.284, 23.323, 23.451, 25.044, 26.044, 27.177, 29.261, 30.795, 31.866, 38.057]","[122.0, 254.0, 286.0, 363.0, 758.0, 945.0, 1008.0, 1242.0, 1348.0, 1603.0, 1763.0, 1858.0, 1935.0, 2053.0, 3035.0, 3063.0, 3113.0, 3294.0, 3577.0, 3658.0, 3659.0, 3771.0, 4270.0, 4344.0, 4377.0, 4686.0, 4886.0, 5199.0, 5290.0, 5725.0, 6205.0, 6228.0, 6310.0, 6639.0, 7296.0, 7320.0, 7571.0, 8566.0, 8580.0, 8932.0, 9716.0, 10612.0, 10901.0, 12201.0, 12342.0, 13250.0, 14089.0, 14136.0, 14610.0, 15033.0, 15038.0, 15660.0, 15819.0, 16846.0, 17273.0, 17310.0, 17824.0, 18769.0, 20156.0, 22085.0, 22181.0, 22575.0, 22581.0, 23284.0, 23323.0, 23451.0, 25044.0, 26044.0, 27177.0, 29261.0, 30795.0, 31866.0, 38057.0]"
11026.333333333334,ÖZEL SANKO FEN VE TEKNOLOJİ LİSESİ (GAZİANTEP - ŞEHİTKAMİL),18,"[1.242, 1.311, 1.391, 1.676, 2.388, 2.392, 3.294, 3.577, 3.771, 5.199, 8.58, 10.612, 17.383, 22.085, 22.575, 23.451, 33.565, 33.982]","[1242.0, 1311.0, 1391.0, 1676.0, 2388.0, 2392.0, 3294.0, 3577.0, 3771.0, 5199.0, 8580.0, 10612.0, 17383.0, 22085.0, 22575.0, 23451.0, 33565.0, 33982.0]"
11093.478873239437,ANKARA FEN LİSESİ (ANKARA - ÇANKAYA),71,"[286.0, 363.0, 386.0, 452.0, 758.0, 945.0, 1.008, 1.242, 1.603, 1.676, 1.858, 1.935, 2.086, 2.388, 2.392, 2.408, 2.474, 2.792, 2.826, 2.887, 3.035, 3.577, 3.658, 3.659, 3.771, 4.27, 4.344, 4.377, 5.199, 6.066, 6.31, 7.31, 7.32, 7.571, 8.201, 8.566, 9.61, 10.386, 10.612, 11.438, 11.733, 12.342, 12.683, 13.25, 13.255, 13.45, 13.487, 14.089, 14.136, 14.61, 14.988, 15.007, 15.033, 16.052, 17.071, 18.769, 18.907, 19.32, 20.156, 23.323, 26.044, 26.18, 27.311, 27.516, 27.586, 27.829, 28.342, 28.414, 28.565, 30.795, 35.349]","[286.0, 363.0, 386.0, 452.0, 758.0, 945.0, 1008.0, 1242.0, 1603.0, 1676.0, 1858.0, 1935.0, 2086.0, 2388.0, 2392.0, 2408.0, 2474.0, 2792.0, 2826.0, 2887.0, 3035.0, 3577.0, 3658.0, 3659.0, 3771.0, 4270.0, 4344.0, 4377.0, 5199.0, 6066.0, 6310.0, 7310.0, 7320.0, 7571.0, 8201.0, 8566.0, 9610.0, 10386.0, 10612.0, 11438.0, 11733.0, 12342.0, 12683.0, 13250.0, 13255.0, 13450.0, 13487.0, 14089.0, 14136.0, 14610.0, 14988.0, 15007.0, 15033.0, 16052.0, 17071.0, 18769.0, 18907.0, 19320.0, 20156.0, 23323.0, 26044.0, 26180.0, 27311.0, 27516.0, 27586.0, 27829.0, 28342.0, 28414.0, 28565.0, 30795.0, 35349.0]"
11182.8,TED BATMAN PETROL KOLEJİ ÖZEL ANADOLU LİSESİ (BATMAN - MERKEZ),10,"[945.0, 1.242, 1.858, 5.787, 8.58, 12.342, 17.949, 19.442, 20.037, 23.646]","[945.0, 1242.0, 1858.0, 5787.0, 8580.0, 12342.0, 17949.0, 19442.0, 20037.0, 23646.0]"
11243.0,ÖZEL KANYON KOLEJİ FEN LİSESİ (UŞAK - MERKEZ),3,"[6.399, 12.342, 14.988]","[6399.0, 12342.0, 14988.0]"
11277.0,ŞEHİT ÖMER HALİSDEMİR KIZ ANADOLU İMAM HATİP LİSESİ (İSTANBUL - ÇEKMEKÖY),1,[11.277],[11277.0]
11277.0,ŞEHİT ALİ BEZİK ANADOLU LİSESİ (ADANA - SEYHAN),1,[11.277],[11277.0]
11277.0,ÖZEL PAZAR AÇI ANADOLU LİSESİ (RİZE - PAZAR),1,[11.277],[11277.0]
11277.0,ÖZEL SEYMEN ANADOLU LİSESİ (KOCAELİ - İZMİT),1,[11.277],[11277.0]
11277.0,BAŞİSKELE ŞEHİT OZAN ÖZEN KIZ ANADOLU İMAM HATİP LİSESİ (KOCAELİ - BAŞİSKELE),1,[11.277],[11277.0]
11324.0,ÖZEL US ULUS ANADOLU LİSESİ (İSTANBUL - SARIYER),1,[11.324],[11324.0]
11383.0,ÖZEL BÜYÜKÇEKMECE AKADEMİ FEN LİSESİ (İSTANBUL - BÜYÜKÇEKMECE),2,"[9.589, 13.177]","[9589.0, 13177.0]"
11429.333333333334,ÖZEL KAHRAMANMARAŞ MODERN BİLİMLER AKADEMİSİ (MBA) FEN LİSESİ (KAHRAMANMARAŞ - ONİKİŞUBAT),3,"[4.099, 5.145, 25.044]","[4099.0, 5145.0, 25044.0]"
11431.5,ÖZEL DİYARBAKIR YEDİİKLİM FEN LİSESİ (DİYARBAKIR - KAYAPINAR),2,"[2.826, 20.037]","[2826.0, 20037.0]"
11439.0,ÖZEL FİNAL OKULLARI FEN LİSESİ (KIRIKKALE - MERKEZ),2,"[3.658, 19.22]","[3658.0, 19220.0]"
11450.625,ÖZEL ATAFEN FEN LİSESİ (KOCAELİ - İZMİT),8,"[3.356, 5.145, 6.399, 9.589, 13.176, 14.988, 16.371, 22.581]","[3356.0, 5145.0, 6399.0, 9589.0, 13176.0, 14988.0, 16370.999999999998, 22581.0]"
11464.9,ÖZEL ORDU ÜNYE FİNAL AKADEMİ FEN LİSESİ (ORDU - ÜNYE),10,"[386.0, 452.0, 1.242, 2.826, 4.344, 9.627, 11.535, 13.487, 31.544, 39.206]","[386.0, 452.0, 1242.0, 2826.0, 4344.0, 9627.0, 11535.0, 13487.0, 31544.0, 39206.0]"
