Median_Success_Rate,High School,Total_Instances,Success_Ranks,Corrected_Success_Ranks
24191.0,CENGİZHAN ANADOLU LİSESİ (İSTANBUL - KAĞITHANE),6,"[3.689, 22.161, 22.669, 27.956, 29.446, 39.225]","[3689.0, 22161.0, 22669.0, 27956.0, 29446.0, 39225.0]"
24196.666666666668,MEHMET CADIL ANADOLU LİSESİ (BURDUR - BUCAK),6,"[17.824, 22.161, 22.192, 23.323, 29.256, 30.424]","[17824.0, 22161.0, 22192.0, 23323.0, 29256.0, 30424.0]"
24206.0,ALPARSLAN ANADOLU LİSESİ (İSTANBUL - PENDİK),3,"[20.037, 24.752, 27.829]","[20037.0, 24752.0, 27829.0]"
24218.0,AYDIN ATATÜRK ANADOLU LİSESİ (AYDIN - EFELER),1,[24.218],[24218.0]
24254.277777777777,YENİŞEHİR ANADOLU İMAM HATİP LİSESİ (MERSİN - YENİŞEHİR),18,"[3.294, 14.61, 17.824, 19.22, 19.538, 20.156, 21.103, 21.427, 22.085, 22.575, 25.654, 26.805, 27.956, 29.333, 30.913, 35.968, 38.608, 39.508]","[3294.0, 14610.0, 17824.0, 19220.0, 19538.0, 20156.0, 21103.0, 21427.0, 22085.0, 22575.0, 25654.0, 26805.0, 27956.0, 29333.0, 30913.0, 35968.0, 38608.0, 39508.0]"
24257.18181818182,FETHİYE ÖMER ÖZYER ANADOLU LİSESİ (MUĞLA - FETHİYE),22,"[9.589, 9.627, 12.683, 13.564, 14.988, 15.007, 18.907, 20.962, 21.156, 22.037, 22.161, 23.389, 27.165, 27.427, 28.236, 28.376, 34.778, 34.888, 35.417, 35.666, 38.608, 39.027]","[9589.0, 9627.0, 12683.0, 13564.0, 14988.0, 15007.0, 18907.0, 20962.0, 21156.0, 22037.0, 22161.0, 23389.0, 27165.0, 27427.0, 28236.0, 28376.0, 34778.0, 34888.0, 35417.0, 35666.0, 38608.0, 39027.0]"
24262.125,TED SAMSUN KOLEJİ ÖZEL LİSESİ (SAMSUN - ATAKUM),8,"[5.199, 15.66, 19.442, 23.457, 23.646, 31.544, 37.31, 37.839]","[5199.0, 15660.0, 19442.0, 23457.0, 23646.0, 31544.0, 37310.0, 37839.0]"
24264.0,ÖZEL MAVİGÜN ANADOLU LİSESİ (İSTANBUL - GAZİOSMANPAŞA),1,[24.264],[24264.0]
24276.0,HALİL BEKMEZCİ ANADOLU LİSESİ (İSTANBUL - BAHÇELİEVLER),2,"[12.236, 36.316]","[12236.0, 36316.0]"
24281.2,YAHYA KEMAL BEYATLI ANADOLU LİSESİ (ŞANLIURFA - HALİLİYE),15,"[7.32, 7.571, 14.136, 19.077, 22.314, 23.094, 23.284, 24.094, 26.474, 26.897, 28.704, 32.716, 35.666, 36.077, 36.794]","[7320.0, 7571.0, 14136.0, 19077.0, 22314.0, 23094.0, 23284.0, 24094.0, 26474.0, 26897.0, 28704.0, 32716.0, 35666.0, 36077.0, 36794.0]"
24296.666666666668,ARİF NİHAT ASYA ANADOLU LİSESİ (VAN - ERCİŞ),3,"[8.58, 27.516, 36.794]","[8580.0, 27516.0, 36794.0]"
24306.69230769231,ADIYAMAN ANADOLU İMAM-HATİP LİSESİ (ADIYAMAN - MERKEZ),13,"[10.901, 12.201, 13.176, 13.25, 14.136, 23.284, 27.311, 28.704, 31.66, 32.565, 36.073, 36.077, 36.649]","[10901.0, 12201.0, 13176.0, 13250.0, 14136.0, 23284.0, 27311.0, 28704.0, 31660.0, 32564.999999999996, 36073.0, 36077.0, 36649.0]"
24312.666666666668,TÜRKİYE ODALAR VE BORSALAR BİRLİĞİ ANADOLU LİSESİ (BURDUR - MERKEZ),3,"[14.988, 23.323, 34.627]","[14988.0, 23323.0, 34627.0]"
24328.25,PROF.DR.NECMETTİN ERBAKAN ANADOLU İMAM HATİP LİSESİ (ŞANLIURFA - HALİLİYE),4,"[8.58, 23.323, 29.333, 36.077]","[8580.0, 23323.0, 29333.0, 36077.0]"
24333.333333333332,TAVŞANLI KIZ ANADOLU İMAM HATİP LİSESİ (KÜTAHYA - TAVŞANLI),3,"[22.161, 23.323, 27.516]","[22161.0, 23323.0, 27516.0]"
24335.0,ÖZEL KEÇİÖREN SINAV ANADOLU LİSESİ (ANKARA - KEÇİÖREN),5,"[10.165, 15.819, 27.586, 30.795, 37.31]","[10165.0, 15819.0, 27586.0, 30795.0, 37310.0]"
24344.5,ÖZEL SINAV ANADOLU LİSESİ (ANKARA - ÇANKAYA),2,"[21.103, 27.586]","[21103.0, 27586.0]"
24344.5,ÖZEL PARK FİNAL FEN VE TEKNOLOJİ LİSESİ (ANKARA - YENİMAHALLE),2,"[21.103, 27.586]","[21103.0, 27586.0]"
24352.333333333332,ÖZEL VAN BİL FEN LİSESİ (VAN - İPEKYOLU),3,"[20.419, 23.448, 29.19]","[20419.0, 23448.0, 29190.0]"
24375.8,ÖZEL FİNAL FEN LİSESİ (ERZURUM - PALANDÖKEN),5,"[5.199, 18.719, 28.414, 30.424, 39.123]","[5199.0, 18719.0, 28414.0, 30424.0, 39123.0]"
24392.571428571428,SENAN İDİN FEN LİSESİ (ŞIRNAK - SİLOPİ),7,"[14.61, 19.077, 19.442, 23.448, 27.311, 27.352, 39.508]","[14610.0, 19077.0, 19442.0, 23448.0, 27311.0, 27352.0, 39508.0]"
24398.75,KARAKÖPRÜ HATİCE KÜBRA KIZ ANADOLU İMAM HATİP LİSESİ (ŞANLIURFA - KARAKÖPRÜ),4,"[11.277, 23.284, 30.469, 32.565]","[11277.0, 23284.0, 30469.0, 32564.999999999996]"
24406.0,ARDAHAN FEN LİSESİ (ARDAHAN - MERKEZ),9,"[5.199, 22.161, 23.094, 23.284, 25.654, 25.811, 27.427, 27.516, 39.508]","[5199.0, 22161.0, 23094.0, 23284.0, 25654.0, 25811.0, 27427.0, 27516.0, 39508.0]"
24415.0,DR. KEMAL NACİ EKŞİ ANADOLU LİSESİ (İSTANBUL - BAĞCILAR),15,"[13.176, 16.371, 17.018, 18.127, 18.6, 19.139, 19.963, 20.06, 22.581, 27.427, 29.049, 31.102, 37.312, 38.057, 38.243]","[13176.0, 16370.999999999998, 17018.0, 18127.0, 18600.0, 19139.0, 19963.0, 20060.0, 22581.0, 27427.0, 29049.0, 31102.0, 37312.0, 38057.0, 38243.0]"
24420.4,GÜLER ŞEVKİ ÖZBEK ANADOLU LİSESİ (DİYARBAKIR - BAĞLAR),5,"[15.038, 19.077, 23.284, 27.909, 36.794]","[15038.0, 19077.0, 23284.0, 27909.0, 36794.0]"
24427.0,ÖZEL BATI ANADOLU LİSESİ (SİVAS - MERKEZ),2,"[21.427, 27.427]","[21427.0, 27427.0]"
24431.4,BAŞKENT ÜNİVERSİTESİ ÖZEL İSKENDERUN BAŞKENT FEN LİSESİ (HATAY - İSKENDERUN),5,"[8.58, 22.581, 22.669, 29.719, 38.608]","[8580.0, 22581.0, 22669.0, 29719.0, 38608.0]"
24451.875,ŞEHİT AHMET ÖZSOY FEN LİSESİ (İZMİR - MENEMEN),24,"[2.086, 5.947, 7.32, 12.683, 16.089, 17.828, 20.419, 21.168, 22.314, 22.581, 23.389, 23.457, 24.094, 26.345, 29.704, 30.796, 31.183, 32.334, 32.946, 34.163, 35.666, 37.002, 38.208, 39.123]","[2086.0, 5947.0, 7320.0, 12683.0, 16088.999999999998, 17828.0, 20419.0, 21168.0, 22314.0, 22581.0, 23389.0, 23457.0, 24094.0, 26345.0, 29704.0, 30796.0, 31183.0, 32334.000000000004, 32946.0, 34163.0, 35666.0, 37002.0, 38208.0, 39123.0]"
24457.571428571428,15 TEMMUZ ŞEHİTLERİ ANADOLU LİSESİ (AĞRI - MERKEZ),7,"[12.683, 18.719, 18.907, 26.18, 27.177, 28.414, 39.123]","[12683.0, 18719.0, 18907.0, 26180.0, 27177.0, 28414.0, 39123.0]"
24461.0,ÖZEL ERZURUM BİLGE ANADOLU LİSESİ (ERZURUM - AZİZİYE),1,[24.461],[24461.0]
24461.0,MEVLANA KIZ ANADOLU LİSESİ (BİNGÖL - MERKEZ),1,[24.461],[24461.0]
24461.0,ÖZEL GÖKAY ANADOLU LİSESİ (OSMANİYE - MERKEZ),1,[24.461],[24461.0]
24475.75,CUMHURİYET ANADOLU LİSESİ (DENİZLİ - PAMUKKALE),4,"[14.988, 17.273, 27.034, 38.608]","[14988.0, 17273.0, 27034.0, 38608.0]"
24488.777777777777,DÜZİÇİ FEN LİSESİ (OSMANİYE - DÜZİÇİ),18,"[6.066, 8.58, 10.612, 11.535, 16.846, 19.077, 21.168, 21.427, 23.284, 27.311, 27.595, 31.66, 32.565, 32.716, 36.077, 36.548, 38.608, 39.123]","[6066.0, 8580.0, 10612.0, 11535.0, 16846.0, 19077.0, 21168.0, 21427.0, 23284.0, 27311.0, 27595.0, 31660.0, 32564.999999999996, 32716.0, 36077.0, 36548.0, 38608.0, 39123.0]"
24492.5,ÖZEL SAMSUN BAHÇEŞEHİR KOLEJİ ATAKUM ANADOLU LİSESİ (SAMSUN - ATAKUM),8,"[11.535, 17.071, 18.719, 19.442, 27.516, 31.449, 33.937, 36.271]","[11535.0, 17071.0, 18719.0, 19442.0, 27516.0, 31449.0, 33937.0, 36271.0]"
24493.666666666668,ŞEHİT NEBİ GÜNDOĞAN ANADOLU LİSESİ (KIRIKKALE - MERKEZ),3,"[15.038, 19.32, 39.123]","[15038.0, 19320.0, 39123.0]"
24510.0,HACI HAKKI ÇALIK ANADOLU İMAM HATİP LİSESİ (TRABZON - YOMRA),1,[24.51],[24510.0]
24512.7,FARABİ ANADOLU LİSESİ (OSMANİYE - MERKEZ),10,"[10.612, 13.125, 16.846, 19.705, 21.168, 27.311, 29.065, 31.66, 36.077, 39.558]","[10612.0, 13125.0, 16846.0, 19705.0, 21168.0, 27311.0, 29065.0, 31660.0, 36077.0, 39558.0]"
24516.521739130436,GÖYNÜK FEN LİSESİ (ANTALYA - KEMER),23,"[5.946, 7.43, 8.58, 13.25, 14.988, 17.824, 17.942, 20.156, 21.168, 22.314, 23.457, 25.811, 27.427, 27.956, 28.342, 29.333, 30.795, 34.627, 35.496, 36.794, 36.921, 38.2, 39.123]","[5946.0, 7430.0, 8580.0, 13250.0, 14988.0, 17824.0, 17942.0, 20156.0, 21168.0, 22314.0, 23457.0, 25811.0, 27427.0, 27956.0, 28342.0, 29333.0, 30795.0, 34627.0, 35496.0, 36794.0, 36921.0, 38200.0, 39123.0]"
24524.5,GAZİLER ANADOLU LİSESİ (DİYARBAKIR - KAYAPINAR),2,"[22.575, 26.474]","[22575.0, 26474.0]"
24528.333333333332,ÖZEL MURAT YILDIRIM FEN LİSESİ (KOCAELİ - BAŞİSKELE),3,"[22.181, 23.818, 27.586]","[22181.0, 23818.0, 27586.0]"
24532.5,ANTALYA ANADOLU İMAM HATİP LİSESİ (ANTALYA - MURATPAŞA),4,"[13.25, 23.783, 26.897, 34.2]","[13250.0, 23783.0, 26897.0, 34200.0]"
24541.2,DÜZCE ARSAL ANADOLU LİSESİ (DÜZCE - MERKEZ),5,"[13.973, 22.314, 22.581, 28.342, 35.496]","[13973.0, 22314.0, 22581.0, 28342.0, 35496.0]"
24563.666666666668,FMV. ÖZEL ERENKÖY IŞIK FEN LİSESİ (İSTANBUL - KADIKÖY),3,"[14.089, 29.719, 29.883]","[14089.0, 29719.0, 29883.0]"
24564.636363636364,ERZİNCAN LİSESİ (ERZİNCAN - MERKEZ),11,"[10.901, 11.535, 17.132, 21.427, 23.272, 27.586, 28.414, 30.322, 31.544, 32.79, 35.288]","[10901.0, 11535.0, 17132.0, 21427.0, 23272.0, 27586.0, 28414.0, 30322.0, 31544.0, 32790.0, 35288.0]"
24571.333333333332,GÜLİZAR ZEKİ OBDAN ANADOLU LİSESİ (İSTANBUL - PENDİK),12,"[5.145, 11.277, 13.485, 14.089, 22.314, 27.815, 27.956, 28.1, 31.45, 34.71, 39.123, 39.392]","[5145.0, 11277.0, 13485.0, 14089.0, 22314.0, 27815.0, 27956.0, 28100.0, 31450.0, 34710.0, 39123.0, 39392.0]"
24572.0,ÖZEL ERYAMAN SINAV ANADOLU LİSESİ (ANKARA - ETİMESGUT),3,"[6.31, 30.469, 36.937]","[6310.0, 30469.0, 36937.0]"
24572.8,ÖZEL SALİHLİ NAZMİ ARIKAN FEN BİLİMLERİ FEN LİSESİ (MANİSA - SALİHLİ),5,"[22.037, 22.161, 23.389, 24.094, 31.183]","[22037.0, 22161.0, 23389.0, 24094.0, 31183.0]"
24588.5,SİNOP ANADOLU LİSESİ (SİNOP - MERKEZ),2,"[21.427, 27.75]","[21427.0, 27750.0]"
24589.0,ÖZEL BAHÇEŞEHİR FİNAL AKADEMİ FEN LİSESİ (İSTANBUL - BAŞAKŞEHİR),1,[24.589],[24589.0]
24592.571428571428,ÖZEL KARADAĞ FEN LİSESİ (KARAMAN - MERKEZ),7,"[9.61, 14.61, 18.333, 29.704, 31.66, 32.565, 35.666]","[9610.0, 14610.0, 18333.0, 29704.0, 31660.0, 32564.999999999996, 35666.0]"
24593.4,TENZİLE ERDOĞAN ANADOLU LİSESİ (ISPARTA - MERKEZ),15,"[7.32, 15.094, 17.824, 18.127, 18.907, 22.581, 25.361, 25.654, 26.383, 27.165, 28.1, 28.342, 34.2, 34.285, 39.558]","[7320.0, 15094.0, 17824.0, 18127.0, 18907.0, 22581.0, 25361.0, 25654.0, 26383.0, 27165.0, 28100.0, 28342.0, 34200.0, 34285.0, 39558.0]"
24603.5,ATATÜRK ANADOLU LİSESİ (ANTALYA - KEPEZ),2,"[15.007, 34.2]","[15007.0, 34200.0]"
24606.375,SERİK FEN LİSESİ (ANTALYA - SERİK),8,"[12.201, 16.552, 17.273, 22.581, 24.13, 34.163, 34.285, 35.666]","[12201.0, 16552.0, 17273.0, 22581.0, 24130.0, 34163.0, 34285.0, 35666.0]"
24608.5,ANKARA ALTINDAĞ BELEDİYESİ KIZ ANADOLU İMAM HATİP LİSESİ (BOLU - MERKEZ),2,"[19.498, 29.719]","[19498.0, 29719.0]"
24612.4,ŞEHİT MUHAMMED İSLAM ALTUĞ ANADOLU İMAM HATİP LİSESİ (YALOVA - ÇİFTLİKKÖY),5,"[18.6, 23.583, 26.805, 26.897, 27.177]","[18600.0, 23583.0, 26805.0, 26897.0, 27177.0]"
24618.571428571428,ÖZEL DENİZLİ İSTEK FEN LİSESİ (DENİZLİ - MERKEZEFENDİ),7,"[3.113, 7.32, 17.828, 34.2, 35.795, 35.831, 38.243]","[3113.0, 7320.0, 17828.0, 34200.0, 35795.0, 35831.0, 38243.0]"
24623.75,ÖZEL İSKENDERUN UĞUR FEN LİSESİ (HATAY - İSKENDERUN),4,"[9.295, 16.846, 35.417, 36.937]","[9295.0, 16846.0, 35417.0, 36937.0]"
24624.125,AKYAZI EYYUP GENÇ FEN LİSESİ (SAKARYA - AKYAZI),32,"[4.099, 5.787, 8.58, 8.932, 11.733, 13.176, 16.089, 18.6, 18.907, 19.22, 22.314, 22.581, 23.36, 23.451, 25.78, 26.18, 27.595, 27.815, 27.829, 27.956, 28.1, 28.342, 31.493, 31.544, 32.79, 33.932, 34.627, 35.079, 36.548, 37.839, 38.136, 39.558]","[4099.0, 5787.0, 8580.0, 8932.0, 11733.0, 13176.0, 16088.999999999998, 18600.0, 18907.0, 19220.0, 22314.0, 22581.0, 23360.0, 23451.0, 25780.0, 26180.0, 27595.0, 27815.0, 27829.0, 27956.0, 28100.0, 28342.0, 31493.0, 31544.0, 32790.0, 33932.0, 34627.0, 35079.0, 36548.0, 37839.0, 38136.0, 39558.0]"
24637.333333333332,ÖZEL SEYDİŞEHİR GENÇ KAMPÜS FEN LİSESİ (KONYA - SEYDİŞEHİR),3,"[3.659, 34.285, 35.968]","[3659.0, 34285.0, 35968.0]"
24646.736842105263,OSMAN ÖTKEN ANADOLU LİSESİ (HATAY - ANTAKYA),19,"[5.29, 5.787, 8.262, 8.58, 10.612, 17.383, 20.419, 22.575, 25.78, 26.382, 26.474, 33.565, 34.531, 34.888, 35.831, 36.077, 37.002, 39.392, 39.458]","[5290.0, 5787.0, 8262.0, 8580.0, 10612.0, 17383.0, 20419.0, 22575.0, 25780.0, 26382.0, 26474.0, 33565.0, 34531.0, 34888.0, 35831.0, 36077.0, 37002.0, 39392.0, 39458.0]"
24655.2,NECİP FAZIL KISAKÜREK ANADOLU LİSESİ (DİYARBAKIR - BAĞLAR),5,"[19.077, 20.156, 23.284, 26.474, 34.285]","[19077.0, 20156.0, 23284.0, 26474.0, 34285.0]"
24665.5,ÖZEL ÜMRANİYE SINAV ANADOLU LİSESİ (İSTANBUL - ÜMRANİYE),2,"[18.907, 30.424]","[18907.0, 30424.0]"
24667.0,TOKİ KAYAŞEHİR ANADOLU LİSESİ (İSTANBUL - BAŞAKŞEHİR),2,"[11.277, 38.057]","[11277.0, 38057.0]"
24669.166666666668,ÖZEL MUTLU EĞİTİM MODELİ ANADOLU LİSESİ (ŞANLIURFA - KARAKÖPRÜ),6,"[8.58, 22.161, 23.284, 26.474, 30.722, 36.794]","[8580.0, 22161.0, 23284.0, 26474.0, 30722.0, 36794.0]"
24680.684210526317,KARŞIYAKA ANADOLU LİSESİ (BİNGÖL - MERKEZ),19,"[3.294, 11.277, 12.342, 13.176, 17.273, 19.077, 21.168, 24.752, 25.044, 28.414, 29.182, 30.424, 30.722, 31.102, 31.544, 31.66, 32.565, 36.794, 39.123]","[3294.0, 11277.0, 12342.0, 13176.0, 17273.0, 19077.0, 21168.0, 24752.0, 25044.0, 28414.0, 29182.0, 30424.0, 30722.0, 31102.0, 31544.0, 31660.0, 32564.999999999996, 36794.0, 39123.0]"
24695.833333333332,ÖZEL SAMSUN SINAV KOLEJİ FEN VE TEKNOLOJİ LİSESİ (SAMSUN - ATAKUM),6,"[16.371, 23.517, 24.752, 25.811, 26.18, 31.544]","[16370.999999999998, 23517.0, 24752.0, 25811.0, 26180.0, 31544.0]"
24735.75,MEHMET GÜNEŞ ANADOLU LİSESİ (ŞANLIURFA - HALİLİYE),8,"[13.25, 14.61, 15.033, 19.077, 26.474, 36.077, 36.571, 36.794]","[13250.0, 14610.0, 15033.0, 19077.0, 26474.0, 36077.0, 36571.0, 36794.0]"
24738.5,MAZIDAĞI ANADOLU LİSESİ (MARDİN - MAZIDAĞI),2,"[12.683, 36.794]","[12683.0, 36794.0]"
24752.0,ATIŞALANI ANADOLU LİSESİ (İSTANBUL - ESENLER),1,[24.752],[24752.0]
24752.0,ÖZEL BURSA ÇÖZÜM KOLEJİ FEN LİSESİ (BURSA - NİLÜFER),1,[24.752],[24752.0]
24752.0,ULUSLARARASI CEVAT ÜLGER ANADOLU İMAM HATİP LİSESİ (ESKİŞEHİR - TEPEBAŞI),1,[24.752],[24752.0]
24752.0,ÖZEL GÜMÜŞHANE FİNAL AKADEMİ ANADOLU LİSESİ (GÜMÜŞHANE - MERKEZ),1,[24.752],[24752.0]
24764.2,ŞEHİT ÖMER TAKDEMİR ANADOLU İMAM HATİP LİSESİ (ANKARA - ÇUBUK),5,"[9.61, 15.007, 30.671, 32.565, 35.968]","[9610.0, 15007.0, 30671.0, 32564.999999999996, 35968.0]"
24768.0,ÖZEL BEYLİKDÜZÜ OĞUZKAAN ANADOLU LİSESİ (İSTANBUL - BEYLİKDÜZÜ),1,[24.768],[24768.0]
24784.9375,BAYBURT FEN LİSESİ (BAYBURT - MERKEZ),16,"[5.29, 8.566, 13.485, 17.828, 18.333, 23.094, 24.461, 26.897, 27.516, 27.75, 28.414, 31.544, 34.2, 34.71, 36.271, 38.2]","[5290.0, 8566.0, 13485.0, 17828.0, 18333.0, 23094.0, 24461.0, 26897.0, 27516.0, 27750.0, 28414.0, 31544.0, 34200.0, 34710.0, 36271.0, 38200.0]"
24790.090909090908,ÖMER ÇAM ANADOLU İMAM HATİP LİSESİ (İSTANBUL - PENDİK),11,"[13.713, 13.973, 22.581, 23.451, 26.345, 26.383, 28.1, 28.342, 29.049, 29.261, 31.493]","[13713.0, 13973.0, 22581.0, 23451.0, 26345.0, 26383.0, 28100.0, 28342.0, 29049.0, 29261.0, 31493.0]"
24791.0,HACI AVNİ KIZ ANADOLU İMAM HATİP LİSESİ (MALATYA - BATTALGAZİ),2,"[21.168, 28.414]","[21168.0, 28414.0]"
24801.0,MAHMUT ÇALIK ANADOLU LİSESİ (MALATYA - YEŞİLYURT),3,"[21.168, 25.044, 28.191]","[21168.0, 25044.0, 28191.0]"
24810.52,AYRANCI ANADOLU LİSESİ (ANKARA - ÇANKAYA),25,"[6.31, 6.65, 11.519, 13.25, 15.007, 15.819, 16.052, 17.071, 20.156, 22.233, 23.646, 26.383, 27.586, 27.75, 28.565, 30.469, 30.795, 30.913, 32.334, 32.565, 33.854, 36.937, 37.002, 37.839, 39.558]","[6310.0, 6650.0, 11519.0, 13250.0, 15007.0, 15819.0, 16052.0, 17071.0, 20156.0, 22233.0, 23646.0, 26383.0, 27586.0, 27750.0, 28565.0, 30469.0, 30795.0, 30913.0, 32334.000000000004, 32564.999999999996, 33854.0, 36937.0, 37002.0, 37839.0, 39558.0]"
24832.0,ŞEHİT ERSİN BACAKSIZ ANADOLU LİSESİ (ANKARA - SİNCAN),3,"[15.007, 29.065, 30.424]","[15007.0, 29065.0, 30424.0]"
24833.0,BESNİ MUSTAFA ERDEMOĞLU ANADOLU LİSESİ (ADIYAMAN - BESNİ),2,"[23.284, 26.382]","[23284.0, 26382.0]"
24838.5,ÖZEL ISPARTA KÜLTÜR ANADOLU LİSESİ (ISPARTA - MERKEZ),2,"[22.161, 27.516]","[22161.0, 27516.0]"
24845.714285714286,ANKARA KIZ ANADOLU İMAM HATİP LİSESİ (ANKARA - ALTINDAĞ),7,"[8.201, 20.419, 23.451, 28.1, 30.608, 30.913, 32.228]","[8201.0, 20419.0, 23451.0, 28100.0, 30608.0, 30913.0, 32228.0]"
24852.0,ÖZEL BURSA KÜLTÜR FEN LİSESİ (BURSA - MUDANYA),16,"[8.262, 9.025, 14.089, 14.988, 15.007, 20.037, 23.323, 27.516, 27.815, 30.722, 30.913, 31.102, 34.643, 35.349, 37.002, 37.839]","[8262.0, 9025.0, 14089.0, 14988.0, 15007.0, 20037.0, 23323.0, 27516.0, 27815.0, 30722.0, 30913.0, 31102.0, 34643.0, 35349.0, 37002.0, 37839.0]"
24853.0,ÖZEL MEHMET ZEKİ DERMAN ANADOLU LİSESİ (ANKARA - ÇANKAYA),2,"[17.018, 32.688]","[17018.0, 32688.000000000004]"
24857.0,ÖZEL DERYA ÖNCÜ ANADOLU LİSESİ (İSTANBUL - ÜSKÜDAR),4,"[10.901, 28.376, 29.049, 31.102]","[10901.0, 28376.0, 29049.0, 31102.0]"
24862.5,ŞEVKİYE ÖZEL FEN LİSESİ (DENİZLİ - ÇİVRİL),4,"[12.286, 17.383, 34.285, 35.496]","[12286.0, 17383.0, 34285.0, 35496.0]"
24865.0,AFYONKARAHİSAR KIZ ANADOLU İMAM HATİP LİSESİ (AFYONKARAHİSAR - MERKEZ),6,"[13.25, 13.973, 22.161, 28.342, 35.496, 35.968]","[13250.0, 13973.0, 22161.0, 28342.0, 35496.0, 35968.0]"
24867.5,ONUR ATEŞ ANADOLU LİSESİ (SAMSUN - ATAKUM),2,"[11.535, 38.2]","[11535.0, 38200.0]"
24867.5,ÇARŞAMBA ANADOLU LİSESİ (SAMSUN - ÇARŞAMBA),2,"[11.535, 38.2]","[11535.0, 38200.0]"
24879.0,NECİP FAZIL KISAKÜREK FEN LİSESİ (ŞANLIURFA - KARAKÖPRÜ),2,"[23.284, 26.474]","[23284.0, 26474.0]"
24879.0,GÜMÜŞHACIKÖY HASAN COCİ ANADOLU LİSESİ (AMASYA - GÜMÜŞHACIKÖY),2,"[13.487, 36.271]","[13487.0, 36271.0]"
24883.666666666668,ÖZEL KEÇİÖREN DOĞA ANADOLU LİSESİ (ANKARA - KEÇİÖREN),3,"[20.156, 22.161, 32.334]","[20156.0, 22161.0, 32334.000000000004]"
24895.8125,ERDOĞAN AKDAĞ FEN LİSESİ (YOZGAT - MERKEZ),16,"[5.199, 9.627, 13.973, 14.136, 19.32, 25.811, 26.18, 26.345, 26.383, 28.1, 28.376, 30.469, 32.688, 35.666, 36.937, 39.123]","[5199.0, 9627.0, 13973.0, 14136.0, 19320.0, 25811.0, 26180.0, 26345.0, 26383.0, 28100.0, 28376.0, 30469.0, 32688.000000000004, 35666.0, 36937.0, 39123.0]"
24904.333333333332,ÖZEL BORNOVA UĞUR ANADOLU LİSESİ (İZMİR - BORNOVA),3,"[8.58, 27.956, 38.177]","[8580.0, 27956.0, 38177.0]"
24905.75,NECİP FAZIL KISAKÜREK FEN LİSESİ (MANİSA - DEMİRCİ),4,"[14.988, 24.094, 27.595, 32.946]","[14988.0, 24094.0, 27595.0, 32946.0]"
24907.0,FETHİYE ANADOLU LİSESİ (MUĞLA - FETHİYE),4,"[17.273, 23.389, 27.516, 31.45]","[17273.0, 23389.0, 27516.0, 31450.0]"
24920.0,ÖZEL DÜZİÇİ SINAV ANADOLU LİSESİ (OSMANİYE - DÜZİÇİ),4,"[8.201, 27.311, 29.883, 34.285]","[8201.0, 27311.0, 29883.0, 34285.0]"
24923.25,ÖZEL UFUK ÇİZGİSİ FEN LİSESİ (ESKİŞEHİR - ODUNPAZARI),4,"[13.255, 26.383, 29.333, 30.722]","[13255.0, 26383.0, 29333.0, 30722.0]"
24925.333333333332,ÖZLÜCE ŞEHİT AYKUT YURTSEVER ANADOLU LİSESİ (BURSA - NİLÜFER),3,"[17.383, 22.314, 35.079]","[17383.0, 22314.0, 35079.0]"
24957.0,ŞEHİT EROL OLÇOK ANADOLU İMAM HATİP LİSESİ (KAHRAMANMARAŞ - ONİKİŞUBAT),4,"[10.795, 27.956, 30.469, 30.608]","[10795.0, 27956.0, 30469.0, 30608.0]"
24959.0,ÖZEL MEKTEBİM KOLEJİ FEN LİSESİ (AKSARAY - MERKEZ),2,"[10.795, 39.123]","[10795.0, 39123.0]"
24962.333333333332,ÖZEL DÖRTYOL FİNAL FEN LİSESİ (HATAY - DÖRTYOL),3,"[15.033, 25.654, 34.2]","[15033.0, 25654.0, 34200.0]"
24963.0,MALATYA ANADOLU İMAM HATİP LİSESİ (MALATYA - BATTALGAZİ),1,[24.963],[24963.0]
24963.0,TÜPRAŞ 50. YİL ANADOLU LİSESİ (KOCAELİ - KÖRFEZ),1,[24.963],[24963.0]
24976.4,YAHYA KEMAL BEYATLI ANADOLU LİSESİ (İSTANBUL - BAKIRKÖY),10,"[7.721, 17.018, 18.662, 22.314, 23.884, 24.768, 28.376, 33.878, 35.831, 37.312]","[7721.0, 17018.0, 18662.0, 22314.0, 23884.0, 24768.0, 28376.0, 33878.0, 35831.0, 37312.0]"
24989.0,ÖZEL KONYA SİSTEM FEN LİSESİ (KONYA - SELÇUKLU),8,"[13.25, 21.103, 22.161, 22.581, 24.768, 27.516, 32.565, 35.968]","[13250.0, 21103.0, 22161.0, 22581.0, 24768.0, 27516.0, 32564.999999999996, 35968.0]"
24989.4,ALP OĞUZ ANADOLU LİSESİ (İZMİR - ALİAĞA),15,"[5.29, 12.683, 15.66, 18.246, 18.333, 21.168, 23.517, 27.427, 29.182, 31.183, 32.79, 34.2, 34.778, 34.888, 35.496]","[5290.0, 12683.0, 15660.0, 18246.0, 18333.0, 21168.0, 23517.0, 27427.0, 29182.0, 31183.0, 32790.0, 34200.0, 34778.0, 34888.0, 35496.0]"
24993.125,BEYDAĞI ANADOLU LİSESİ (MALATYA - YEŞİLYURT),16,"[1.935, 10.795, 14.988, 17.824, 19.569, 21.168, 23.284, 25.044, 27.311, 28.704, 30.469, 31.102, 34.778, 36.794, 37.002, 39.123]","[1935.0, 10795.0, 14988.0, 17824.0, 19569.0, 21168.0, 23284.0, 25044.0, 27311.0, 28704.0, 30469.0, 31102.0, 34778.0, 36794.0, 37002.0, 39123.0]"
24995.333333333332,FATİH ANADOLU LİSESİ (HATAY - İSKENDERUN),3,"[21.427, 26.382, 27.177]","[21427.0, 26382.0, 27177.0]"
24997.0,ÖZEL DİYARBAKIR UMUT FEN LİSESİ (DİYARBAKIR - BAĞLAR),2,"[22.085, 27.909]","[22085.0, 27909.0]"
25024.666666666668,ÖZEL ÜÇGEN KOLEJİ FEN LİSESİ (SAMSUN - İLKADIM),3,"[23.517, 24.13, 27.427]","[23517.0, 24130.0, 27427.0]"
25038.0,HASANOĞLAN ATATÜRK FEN LİSESİ (ANKARA - ELMADAĞ),6,"[13.25, 13.487, 23.583, 30.795, 32.565, 36.548]","[13250.0, 13487.0, 23583.0, 30795.0, 32564.999999999996, 36548.0]"
25043.14285714286,CUMHURİYET ANADOLU LİSESİ (İSTANBUL - SULTANGAZİ),7,"[11.733, 15.038, 23.884, 24.589, 27.956, 35.831, 36.271]","[11733.0, 15038.0, 23884.0, 24589.0, 27956.0, 35831.0, 36271.0]"
25043.636363636364,YAKUTİYE ANADOLU İMAM HATİP LİSESİ (ERZURUM - YAKUTİYE),11,"[3.577, 14.988, 18.719, 23.583, 24.461, 26.897, 27.427, 28.414, 30.722, 37.569, 39.123]","[3577.0, 14988.0, 18719.0, 23583.0, 24461.0, 26897.0, 27427.0, 28414.0, 30722.0, 37569.0, 39123.0]"
25044.0,HACI SABANCI ANADOLU LİSESİ (İSTANBUL - ÜSKÜDAR),3,"[18.127, 27.956, 29.049]","[18127.0, 27956.0, 29049.0]"
25044.0,KOCAELİ YÜKSEK ÖĞRENİM VAKFI ÖZEL ANADOLU LİSESİ (KOCAELİ - İZMİT),1,[25.044],[25044.0]
25044.0,ÖZEL TATVAN FİNAL ANADOLU LİSESİ (BİTLİS - TATVAN),1,[25.044],[25044.0]
25045.2,MANİSA HASAN TÜREK ANADOLU LİSESİ (MANİSA - YUNUSEMRE),5,"[15.038, 21.168, 24.094, 30.038, 34.888]","[15038.0, 21168.0, 24094.0, 30038.0, 34888.0]"
25053.0,ÖZEL ALANYA YEDİ BİLİM FEN LİSESİ (ANTALYA - ALANYA),2,"[14.61, 35.496]","[14610.0, 35496.0]"
25059.0,ÖZEL KIZILTEPE UĞUR ANADOLU LİSESİ (MARDİN - KIZILTEPE),2,"[13.324, 36.794]","[13324.0, 36794.0]"
25063.0,ÖZEL NAZMİ ARIKAN FEN BİLİMLERİ BAHÇELİEVLER ANADOLU LİSESİ (İSTANBUL - BAHÇELİEVLER),3,"[20.037, 27.337, 27.815]","[20037.0, 27337.0, 27815.0]"
25067.615384615383,OF FEN LİSESİ (TRABZON - OF),13,"[3.064, 13.487, 16.089, 19.22, 22.581, 23.094, 24.264, 26.897, 30.424, 35.288, 36.077, 36.271, 39.123]","[3064.0, 13487.0, 16088.999999999998, 19220.0, 22581.0, 23094.0, 24264.0, 26897.0, 30424.0, 35288.0, 36077.0, 36271.0, 39123.0]"
25070.25,MEHMET AKİF ERSOY ANADOLU LİSESİ (BATMAN - MERKEZ),4,"[19.077, 20.962, 23.448, 36.794]","[19077.0, 20962.0, 23448.0, 36794.0]"
25079.25,DENİZLİ ANADOLU İMAM HATİP LİSESİ (DENİZLİ - MERKEZEFENDİ),4,"[10.901, 18.333, 35.417, 35.666]","[10901.0, 18333.0, 35417.0, 35666.0]"
25084.0,MİMAR SİNAN ANADOLU LİSESİ (ÇORUM - MERKEZ),2,"[17.071, 33.097]","[17071.0, 33097.0]"
25089.333333333332,KUMRAL ABDAL ANADOLU LİSESİ (BİLECİK - BOZÜYÜK),3,"[20.419, 22.161, 32.688]","[20419.0, 22161.0, 32688.000000000004]"
25106.875,ÖZEL AYDIN FİNAL AKADEMİ FEN LİSESİ (AYDIN - EFELER),8,"[7.32, 12.683, 23.352, 24.094, 27.034, 34.888, 35.417, 36.067]","[7320.0, 12683.0, 23352.0, 24094.0, 27034.0, 34888.0, 35417.0, 36067.0]"
25127.6,ARDEŞEN ŞEHİT ÖMER HALİSDEMİR FEN LİSESİ (RİZE - ARDEŞEN),5,"[14.988, 15.007, 23.094, 36.271, 36.278]","[14988.0, 15007.0, 23094.0, 36271.0, 36278.0]"
25131.75,TURGUTLU ANADOLU LİSESİ (MANİSA - TURGUTLU),4,"[13.176, 17.828, 34.163, 35.36]","[13176.0, 17828.0, 34163.0, 35360.0]"
25149.0,DR. GÜNGÖR ÖZBEK ANADOLU LİSESİ (İZMİR - GÜZELBAHÇE),3,"[14.988, 23.457, 37.002]","[14988.0, 23457.0, 37002.0]"
25160.5,HACI MURAT-HATİCE ÖZSOY ANADOLU LİSESİ (İZMİR - ÇEŞME),2,"[22.085, 28.236]","[22085.0, 28236.0]"
25161.090909090908,SÜLEYMAN DEMİREL ANADOLU LİSESİ (ANKARA - SİNCAN),22,"[6.31, 9.716, 10.139, 13.25, 15.007, 15.819, 19.32, 19.498, 21.103, 23.451, 24.094, 24.13, 32.334, 32.565, 34.037, 34.163, 34.627, 34.888, 35.288, 36.937, 37.31, 39.558]","[6310.0, 9716.0, 10139.0, 13250.0, 15007.0, 15819.0, 19320.0, 19498.0, 21103.0, 23451.0, 24094.0, 24130.0, 32334.000000000004, 32564.999999999996, 34037.0, 34163.0, 34627.0, 34888.0, 35288.0, 36937.0, 37310.0, 39558.0]"
25181.0,VAN ATATÜRK ANADOLU LİSESİ (VAN - İPEKYOLU),6,"[9.627, 10.165, 23.448, 31.544, 36.794, 39.508]","[9627.0, 10165.0, 23448.0, 31544.0, 36794.0, 39508.0]"
25183.6,MEHMET-HANİFE YAPICI ANADOLU LİSESİ (KONYA - KARATAY),5,"[5.787, 25.361, 28.342, 32.565, 33.863]","[5787.0, 25361.0, 28342.0, 32564.999999999996, 33863.0]"
25194.5,ÖZEL TAVŞANLI BİL ANADOLU LİSESİ (KÜTAHYA - TAVŞANLI),2,"[17.824, 32.565]","[17824.0, 32564.999999999996]"
25223.23076923077,ANKARA ÖZEL TEVFİK FİKRET ANADOLU LİSESİ (ANKARA - ÇANKAYA),13,"[1.242, 7.583, 7.769, 13.45, 21.103, 27.75, 27.956, 34.037, 35.288, 35.652, 37.839, 39.027, 39.206]","[1242.0, 7583.0, 7769.0, 13450.0, 21103.0, 27750.0, 27956.0, 34037.0, 35288.0, 35652.0, 37839.0, 39027.0, 39206.0]"
25223.4,HALİS GÜLLE ANADOLU LİSESİ (SİVAS - MERKEZ),5,"[21.427, 23.284, 23.517, 26.345, 31.544]","[21427.0, 23284.0, 23517.0, 26345.0, 31544.0]"
25230.5,SELAHADDİN EYYUBİ ANADOLU İMAM HATİP LİSESİ (DİYARBAKIR - BİSMİL),2,"[23.284, 27.177]","[23284.0, 27177.0]"
25233.6,BURSA MERKEZ ANADOLU İMAM HATİP LİSESİ (BURSA - YILDIRIM),5,"[13.324, 22.314, 26.805, 28.376, 35.349]","[13324.0, 22314.0, 26805.0, 28376.0, 35349.0]"
25233.75,SURUÇ FEN LİSESİ (ŞANLIURFA - SURUÇ),12,"[12.683, 13.176, 16.846, 17.828, 19.077, 26.382, 26.474, 27.311, 33.565, 34.778, 36.077, 38.608]","[12683.0, 13176.0, 16846.0, 17828.0, 19077.0, 26382.0, 26474.0, 27311.0, 33565.0, 34778.0, 36077.0, 38608.0]"
